{
  "metadata": {
    "schema_version": "1.2.0",
    "processing_version": "demo-1.0.0",
    "rules_version": "1.0.0",
    "run_id": "DEMO-20261004",
    "generated_at": "2026-10-04T12:00:00Z"
  },
  "mentions": [
    {
      "id_mencion": "demo-mention-001",
      "hash_mencion": "fefa0fcd3c6080ada9fdf09bf91404766a926e98fd27e5e4855c0dc64ae10451",
      "fuente": "demo",
      "fecha": "2026-09-20T17:00:00Z",
      "texto_original": "Mi pedido lleva tres días de retraso y todavía no llega",
      "texto_limpio": "Mi pedido lleva tres días de retraso y todavía no llega",
      "sentimiento_pysentimiento": "negativo",
      "score_sentimiento": -0.76,
      "confianza_sentimiento": 0.94,
      "entidad_detectada": null,
      "categoria": "logistica",
      "subcategoria": "",
      "regla_activada": "logistica",
      "reglas_activadas": [
        "logistica"
      ],
      "prioridad_regla": 1,
      "factores_score": [
        {
          "factor": "sentimiento",
          "value": 78
        },
        {
          "factor": "urgencia",
          "value": 10
        },
        {
          "factor": "categoria",
          "value": 5
        }
      ],
      "score_matematico": 78,
      "severidad": "alta",
      "calidad_dato": "alta",
      "es_duplicado": false,
      "tiene_error": false,
      "advertencias": [],
      "procesado_en": "2026-10-04T12:00:00Z",
      "version_procesamiento": "1.0.0",
      "version_reglas": "1.0.0",
      "version_schema": "1.2.0"
    },
    {
      "id_mencion": "demo-mention-002",
      "hash_mencion": "99964ec59f273b5b92a1ce97060dec902dfa74ba82624886257853bcded892bc",
      "fuente": "demo",
      "fecha": "2026-09-21T00:00:00Z",
      "texto_original": "La atención por chat fue excelente, me ayudaron rápido",
      "texto_limpio": "La atención por chat fue excelente, me ayudaron rápido",
      "sentimiento_pysentimiento": "positivo",
      "score_sentimiento": 0.72,
      "confianza_sentimiento": 0.91,
      "entidad_detectada": null,
      "categoria": "servicio",
      "subcategoria": "",
      "regla_activada": "servicio",
      "reglas_activadas": [
        "servicio"
      ],
      "prioridad_regla": 2,
      "factores_score": [
        {
          "factor": "sentimiento",
          "value": 12
        },
        {
          "factor": "urgencia",
          "value": 0
        },
        {
          "factor": "categoria",
          "value": 0
        }
      ],
      "score_matematico": 12,
      "severidad": "baja",
      "calidad_dato": "alta",
      "es_duplicado": false,
      "tiene_error": false,
      "advertencias": [],
      "procesado_en": "2026-10-04T12:00:00Z",
      "version_procesamiento": "1.0.0",
      "version_reglas": "1.0.0",
      "version_schema": "1.2.0"
    },
    {
      "id_mencion": "demo-mention-003",
      "hash_mencion": "fc34f4743586006bfa9365fee6033b6b99fb51b3730182fb9c3bd255c62da6e2",
      "fuente": "demo",
      "fecha": "2026-09-21T07:00:00Z",
      "texto_original": "Me cobraron dos veces el mismo pedido",
      "texto_limpio": "Me cobraron dos veces el mismo pedido",
      "sentimiento_pysentimiento": "negativo",
      "score_sentimiento": -0.76,
      "confianza_sentimiento": 0.94,
      "entidad_detectada": null,
      "categoria": "facturacion",
      "subcategoria": "",
      "regla_activada": "facturacion",
      "reglas_activadas": [
        "facturacion"
      ],
      "prioridad_regla": 1,
      "factores_score": [
        {
          "factor": "sentimiento",
          "value": 82
        },
        {
          "factor": "urgencia",
          "value": 10
        },
        {
          "factor": "categoria",
          "value": 5
        }
      ],
      "score_matematico": 82,
      "severidad": "critica",
      "calidad_dato": "alta",
      "es_duplicado": false,
      "tiene_error": false,
      "advertencias": [],
      "procesado_en": "2026-10-04T12:00:00Z",
      "version_procesamiento": "1.0.0",
      "version_reglas": "1.0.0",
      "version_schema": "1.2.0"
    },
    {
      "id_mencion": "demo-mention-004",
      "hash_mencion": "a092a5bc340d05f2be35e47e90e38eeabd7acb5a8d008d4336426127583622ab",
      "fuente": "demo",
      "fecha": "2026-09-21T14:00:00Z",
      "texto_original": "¿Me pueden confirmar cuándo llegará mi paquete?",
      "texto_limpio": "¿Me pueden confirmar cuándo llegará mi paquete?",
      "sentimiento_pysentimiento": "neutro",
      "score_sentimiento": 0.05,
      "confianza_sentimiento": 0.82,
      "entidad_detectada": null,
      "categoria": "entrega",
      "subcategoria": "",
      "regla_activada": "entrega",
      "reglas_activadas": [
        "entrega"
      ],
      "prioridad_regla": 2,
      "factores_score": [
        {
          "factor": "sentimiento",
          "value": 42
        },
        {
          "factor": "urgencia",
          "value": 0
        },
        {
          "factor": "categoria",
          "value": 0
        }
      ],
      "score_matematico": 42,
      "severidad": "media",
      "calidad_dato": "alta",
      "es_duplicado": false,
      "tiene_error": false,
      "advertencias": [],
      "procesado_en": "2026-10-04T12:00:00Z",
      "version_procesamiento": "1.0.0",
      "version_reglas": "1.0.0",
      "version_schema": "1.2.0"
    },
    {
      "id_mencion": "demo-mention-005",
      "hash_mencion": "0f6e417683422e4401ed58d1a9b674088438ee426ab8a4d6c2e8316685af048d",
      "fuente": "demo",
      "fecha": "2026-09-21T21:00:00Z",
      "texto_original": "Gracias por resolver mi problema tan rápido",
      "texto_limpio": "Gracias por resolver mi problema tan rápido",
      "sentimiento_pysentimiento": "positivo",
      "score_sentimiento": 0.72,
      "confianza_sentimiento": 0.91,
      "entidad_detectada": null,
      "categoria": "soporte",
      "subcategoria": "",
      "regla_activada": "soporte",
      "reglas_activadas": [
        "soporte"
      ],
      "prioridad_regla": 2,
      "factores_score": [
        {
          "factor": "sentimiento",
          "value": 10
        },
        {
          "factor": "urgencia",
          "value": 0
        },
        {
          "factor": "categoria",
          "value": 0
        }
      ],
      "score_matematico": 10,
      "severidad": "baja",
      "calidad_dato": "alta",
      "es_duplicado": false,
      "tiene_error": false,
      "advertencias": [],
      "procesado_en": "2026-10-04T12:00:00Z",
      "version_procesamiento": "1.0.0",
      "version_reglas": "1.0.0",
      "version_schema": "1.2.0"
    },
    {
      "id_mencion": "demo-mention-006",
      "hash_mencion": "8b3f19396b53c1f1caef4c1f673da79654f43d5dce604ab751000e594805c74e",
      "fuente": "demo",
      "fecha": "2026-09-22T04:00:00Z",
      "texto_original": "El paquete aparece entregado pero yo no lo recibí",
      "texto_limpio": "El paquete aparece entregado pero yo no lo recibí",
      "sentimiento_pysentimiento": "negativo",
      "score_sentimiento": -0.76,
      "confianza_sentimiento": 0.94,
      "entidad_detectada": null,
      "categoria": "logistica",
      "subcategoria": "",
      "regla_activada": "logistica",
      "reglas_activadas": [
        "logistica"
      ],
      "prioridad_regla": 1,
      "factores_score": [
        {
          "factor": "sentimiento",
          "value": 88
        },
        {
          "factor": "urgencia",
          "value": 10
        },
        {
          "factor": "categoria",
          "value": 5
        }
      ],
      "score_matematico": 88,
      "severidad": "critica",
      "calidad_dato": "alta",
      "es_duplicado": false,
      "tiene_error": false,
      "advertencias": [],
      "procesado_en": "2026-10-04T12:00:00Z",
      "version_procesamiento": "1.0.0",
      "version_reglas": "1.0.0",
      "version_schema": "1.2.0"
    },
    {
      "id_mencion": "demo-mention-007",
      "hash_mencion": "de37662505adce1e7fdf0bbb5574725e160e003d02545e7cff4d915e859ff92f",
      "fuente": "demo",
      "fecha": "2026-09-22T11:00:00Z",
      "texto_original": "Quiero saber si todavía tienen disponibilidad",
      "texto_limpio": "Quiero saber si todavía tienen disponibilidad",
      "sentimiento_pysentimiento": "neutro",
      "score_sentimiento": 0.05,
      "confianza_sentimiento": 0.82,
      "entidad_detectada": null,
      "categoria": "producto",
      "subcategoria": "",
      "regla_activada": "producto",
      "reglas_activadas": [
        "producto"
      ],
      "prioridad_regla": 2,
      "factores_score": [
        {
          "factor": "sentimiento",
          "value": 35
        },
        {
          "factor": "urgencia",
          "value": 0
        },
        {
          "factor": "categoria",
          "value": 0
        }
      ],
      "score_matematico": 35,
      "severidad": "media",
      "calidad_dato": "alta",
      "es_duplicado": false,
      "tiene_error": false,
      "advertencias": [],
      "procesado_en": "2026-10-04T12:00:00Z",
      "version_procesamiento": "1.0.0",
      "version_reglas": "1.0.0",
      "version_schema": "1.2.0"
    },
    {
      "id_mencion": "demo-mention-008",
      "hash_mencion": "32763af5a0dddc3a0c3bc68eb4013c063688e0f8e6935e6626160cd2a37e5e17",
      "fuente": "demo",
      "fecha": "2026-09-22T18:00:00Z",
      "texto_original": "Llevo mucho tiempo esperando una respuesta",
      "texto_limpio": "Llevo mucho tiempo esperando una respuesta",
      "sentimiento_pysentimiento": "negativo",
      "score_sentimiento": -0.76,
      "confianza_sentimiento": 0.94,
      "entidad_detectada": null,
      "categoria": "servicio",
      "subcategoria": "",
      "regla_activada": "servicio",
      "reglas_activadas": [
        "servicio"
      ],
      "prioridad_regla": 1,
      "factores_score": [
        {
          "factor": "sentimiento",
          "value": 67
        },
        {
          "factor": "urgencia",
          "value": 10
        },
        {
          "factor": "categoria",
          "value": 0
        }